{
  "activation_state": "not_activated",
  "analysis_id": "expected-population-synthetic",
  "analysis_result_id": "ana-c7ea52d7ef45016ab5005b36",
  "created_at": "2026-08-27T00:00:00Z",
  "dependence": "independent",
  "dependence_rationale": "The synthetic reference assumes independence solely to exercise a declared and reproducible dependence contract.",
  "estimand": "expected_affected_population",
  "evidence_statuses": [
    "observed",
    "assumed"
  ],
  "intended_use": "synthetic_assurance",
  "interpretation": "Repository-owned synthetic assurance; not an empirical burden estimate, activation, publication or release authority.",
  "ledger_id": "public-foundation-synthetic-ledger",
  "left_parameter_fingerprint": "par-6f319b1a2dc6aad9c1db9839",
  "left_parameter_id": "australia-population-synthetic",
  "limitations": [
    "Synthetic assurance only; no empirical interpretation or policy use is permitted."
  ],
  "output_unit": "people",
  "quality_disposition_id": "qdp-757f1136634049b87de6ee07",
  "right_parameter_fingerprint": "par-762e1bc676f8cef798688fcc",
  "right_parameter_id": "rare-diabetes-fraction-synthetic",
  "runtime": {
    "python_implementation": "CPython",
    "python_version": "3.14.5",
    "random_engine": "rareburden.pcg32-box-muller-marsaglia-tsang.v1",
    "software_version": "0.3.0rc2"
  },
  "schema_version": "1.0.0",
  "summary": {
    "interval_probability": 0.95,
    "iterations": 10000,
    "lower": 66342.919797,
    "mean": 530108.139306,
    "median": 443889.306195,
    "seed": 20260719,
    "standard_deviation": 371357.483813,
    "upper": 1468776.335375
  }
}
