{"activation_state":"not_activated","analysis_id":"track-003-rbc-p002-synthetic","analysis_result_id":"ana-829fd04b2d34179a81729079","created_at":"2026-08-29T00:00:00Z","dependence":"independent","dependence_rationale":"Independence is an explicit synthetic assurance assumption and is not asserted for any empirical population.","estimand":"rare_aetiology_cases","evidence_statuses":["assumed","assumed"],"intended_use":"synthetic_assurance","interpretation":"Repository-owned synthetic assurance; not an empirical burden estimate, activation, publication or release authority.","ledger_id":"track-003-rbc-p002-synthetic-ledger","left_parameter_fingerprint":"par-6698d5070bf1fa4a8a609d8b","left_parameter_id":"rbc-p002-diabetes-denominator-synthetic","limitations":["Synthetic protocol compatibility only; no empirical, clinical, policy or patient-facing interpretation is permitted.","The denominator and aetiologic fraction are transparent assumptions rather than observed quantities.","Gene, phenotype, ascertainment, penetrance and clinical entity scope remain unfrozen."],"output_unit":"people","quality_disposition_id":"qdp-0c287cfade8b8645565542f0","right_parameter_fingerprint":"par-d936ba066d9534e581060f38","right_parameter_id":"rbc-p002-aetiologic-fraction-synthetic","runtime":{"python_implementation":"CPython","python_version":"3.14.5","random_engine":"rareburden.pcg32-box-muller-marsaglia-tsang.v1","software_version":"0.3.0rc2"},"schema_version":"1.0.0","summary":{"interval_probability":0.95,"iterations":10000,"lower":257.661651,"mean":2005.628674,"median":1677.964054,"seed":20260829,"standard_deviation":1387.496188,"upper":5445.807024}}
